{
  "alignment_score": 0.87,
  "vision": "Empower sustainable urban mobility",
  "decision": "Invest in electric bus fleet expansion",
  "model_info": {
    "model_name": "llama-3.1-8b-instruct-finetuned",
    "version": "v1.2.0",
    "fine_tune_date": "2025-08-15"
  },
  "timestamp_utc": "2025-08-22T13:44:00Z",
  "explanation": "The decision directly supports the sustainability goal and urban mobility focus."
}